{
  "schemaVersion": 1,
  "id": "hand-near-hair-or-forehead",
  "title": "手靠近头发或额头",
  "tags": ["半身", "手部动作", "镜像可用"],
  "source": {
    "platform": "owned",
    "usageStatus": "owned",
    "capturedAt": "2026-08-18T06:55:00Z",
    "licenseEvidence": "Posey original abstract skeleton; no Xiaohongshu pixels, contours, or creator artwork were copied."
  },
  "shotType": "half-body",
  "mirrorAllowed": true,
  "normalization": {
    "origin": "hip-center",
    "scaleBasis": "torso-length",
    "referenceScale": 0.25
  },
  "landmarks": {
    "nose": { "position": { "x": 0.5, "y": 0.14 }, "visible": true, "weight": 0.65, "critical": false },
    "leftEyeInner": { "position": { "x": 0.486, "y": 0.132 }, "visible": true, "weight": 0.2, "critical": false },
    "leftEye": { "position": { "x": 0.478, "y": 0.13 }, "visible": true, "weight": 0.25, "critical": false },
    "leftEyeOuter": { "position": { "x": 0.469, "y": 0.133 }, "visible": true, "weight": 0.2, "critical": false },
    "rightEyeInner": { "position": { "x": 0.514, "y": 0.132 }, "visible": true, "weight": 0.2, "critical": false },
    "rightEye": { "position": { "x": 0.522, "y": 0.13 }, "visible": true, "weight": 0.25, "critical": false },
    "rightEyeOuter": { "position": { "x": 0.531, "y": 0.133 }, "visible": true, "weight": 0.2, "critical": false },
    "leftEar": { "position": { "x": 0.456, "y": 0.15 }, "visible": true, "weight": 0.35, "critical": false },
    "rightEar": { "position": { "x": 0.544, "y": 0.15 }, "visible": true, "weight": 0.55, "critical": false },
    "leftMouth": { "position": { "x": 0.488, "y": 0.171 }, "visible": true, "weight": 0.2, "critical": false },
    "rightMouth": { "position": { "x": 0.512, "y": 0.171 }, "visible": true, "weight": 0.2, "critical": false },
    "leftShoulder": { "position": { "x": 0.43, "y": 0.26 }, "visible": true, "weight": 0.75, "critical": false },
    "rightShoulder": { "position": { "x": 0.57, "y": 0.26 }, "visible": true, "weight": 0.9, "critical": true },
    "leftElbow": { "position": { "x": 0.37, "y": 0.38 }, "visible": true, "weight": 0.65, "critical": false },
    "rightElbow": { "position": { "x": 0.63, "y": 0.31 }, "visible": true, "weight": 1, "critical": true },
    "leftWrist": { "position": { "x": 0.33, "y": 0.5 }, "visible": true, "weight": 0.65, "critical": false },
    "rightWrist": { "position": { "x": 0.54, "y": 0.17 }, "visible": true, "weight": 1, "critical": true },
    "leftPinky": { "position": { "x": 0.322, "y": 0.51 }, "visible": true, "weight": 0.2, "critical": false },
    "rightPinky": { "position": { "x": 0.535, "y": 0.158 }, "visible": true, "weight": 0.35, "critical": false },
    "leftIndex": { "position": { "x": 0.326, "y": 0.515 }, "visible": true, "weight": 0.2, "critical": false },
    "rightIndex": { "position": { "x": 0.542, "y": 0.154 }, "visible": true, "weight": 0.35, "critical": false },
    "leftThumb": { "position": { "x": 0.338, "y": 0.503 }, "visible": true, "weight": 0.2, "critical": false },
    "rightThumb": { "position": { "x": 0.55, "y": 0.166 }, "visible": true, "weight": 0.35, "critical": false },
    "leftHip": { "position": { "x": 0.46, "y": 0.51 }, "visible": true, "weight": 0.45, "critical": false },
    "rightHip": { "position": { "x": 0.54, "y": 0.51 }, "visible": true, "weight": 0.45, "critical": false },
    "leftKnee": { "position": { "x": 0.44, "y": 0.78 }, "visible": false, "weight": 0.1, "critical": false },
    "rightKnee": { "position": { "x": 0.56, "y": 0.78 }, "visible": false, "weight": 0.1, "critical": false },
    "leftAnkle": { "position": { "x": 0.44, "y": 1.05 }, "visible": false, "weight": 0.05, "critical": false },
    "rightAnkle": { "position": { "x": 0.56, "y": 1.05 }, "visible": false, "weight": 0.05, "critical": false },
    "leftHeel": { "position": { "x": 0.435, "y": 1.065 }, "visible": false, "weight": 0.05, "critical": false },
    "rightHeel": { "position": { "x": 0.565, "y": 1.065 }, "visible": false, "weight": 0.05, "critical": false },
    "leftFootIndex": { "position": { "x": 0.425, "y": 1.075 }, "visible": false, "weight": 0.05, "critical": false },
    "rightFootIndex": { "position": { "x": 0.575, "y": 1.075 }, "visible": false, "weight": 0.05, "critical": false }
  },
  "relations": [
    {
      "type": "near",
      "from": "rightWrist",
      "to": "rightEar",
      "target": 0.03,
      "tolerance": 0.16,
      "critical": true,
      "simpleHint": "手再靠近头发"
    }
  ],
  "guideContour": [
    { "x": 0.455, "y": 0.105 },
    { "x": 0.425, "y": 0.155 },
    { "x": 0.43, "y": 0.235 },
    { "x": 0.37, "y": 0.285 },
    { "x": 0.34, "y": 0.39 },
    { "x": 0.31, "y": 0.51 },
    { "x": 0.42, "y": 0.54 },
    { "x": 0.46, "y": 0.56 },
    { "x": 0.54, "y": 0.56 },
    { "x": 0.59, "y": 0.46 },
    { "x": 0.66, "y": 0.35 },
    { "x": 0.59, "y": 0.25 },
    { "x": 0.565, "y": 0.195 },
    { "x": 0.575, "y": 0.135 },
    { "x": 0.535, "y": 0.1 },
    { "x": 0.455, "y": 0.105 }
  ],
  "tolerancePresets": {
    "easy": { "matchThreshold": 72, "stableMs": 600, "landmarkDistance": 0.28, "angleDifferenceDeg": 34 },
    "standard": { "matchThreshold": 82, "stableMs": 600, "landmarkDistance": 0.2, "angleDifferenceDeg": 24 },
    "precise": { "matchThreshold": 90, "stableMs": 600, "landmarkDistance": 0.14, "angleDifferenceDeg": 16 }
  },
  "review": {
    "status": "needs-review",
    "notes": "Research-source admission is complete at 6 posts and 5 stable creators. Coordinates and contour are an owned abstract draft derived from the existing Posey hand-by-face prototype, not from research screenshots. Requires authorized-person calibration across 3-5 body/action variants, false-pass testing, and real-device acceptance before approval."
  }
}
