{
  "schemaVersion": 1,
  "id": "back-facing-arms-open",
  "title": "背对镜头张开双臂",
  "tags": ["全身", "背影", "双臂打开", "镜像可用"],
  "source": {
    "platform": "owned",
    "usageStatus": "owned",
    "capturedAt": "2026-08-19T06:53:01Z",
    "licenseEvidence": "Posey original abstract skeleton; no Xiaohongshu pixels, contours, or creator artwork were copied."
  },
  "shotType": "full-body",
  "mirrorAllowed": true,
  "normalization": {
    "origin": "hip-center",
    "scaleBasis": "torso-length",
    "referenceScale": 0.28
  },
  "landmarks": {
    "nose": { "position": { "x": 0.5, "y": 0.12 }, "visible": false, "weight": 0.1, "critical": false },
    "leftEyeInner": { "position": { "x": 0.486, "y": 0.111 }, "visible": false, "weight": 0.05, "critical": false },
    "leftEye": { "position": { "x": 0.477, "y": 0.11 }, "visible": false, "weight": 0.05, "critical": false },
    "leftEyeOuter": { "position": { "x": 0.468, "y": 0.113 }, "visible": false, "weight": 0.05, "critical": false },
    "rightEyeInner": { "position": { "x": 0.514, "y": 0.111 }, "visible": false, "weight": 0.05, "critical": false },
    "rightEye": { "position": { "x": 0.523, "y": 0.11 }, "visible": false, "weight": 0.05, "critical": false },
    "rightEyeOuter": { "position": { "x": 0.532, "y": 0.113 }, "visible": false, "weight": 0.05, "critical": false },
    "leftEar": { "position": { "x": 0.455, "y": 0.135 }, "visible": true, "weight": 0.3, "critical": false },
    "rightEar": { "position": { "x": 0.545, "y": 0.135 }, "visible": true, "weight": 0.3, "critical": false },
    "leftMouth": { "position": { "x": 0.488, "y": 0.153 }, "visible": false, "weight": 0.05, "critical": false },
    "rightMouth": { "position": { "x": 0.512, "y": 0.153 }, "visible": false, "weight": 0.05, "critical": false },
    "leftShoulder": { "position": { "x": 0.41, "y": 0.25 }, "visible": true, "weight": 0.9, "critical": true },
    "rightShoulder": { "position": { "x": 0.59, "y": 0.25 }, "visible": true, "weight": 0.9, "critical": true },
    "leftElbow": { "position": { "x": 0.25, "y": 0.28 }, "visible": true, "weight": 1, "critical": true },
    "rightElbow": { "position": { "x": 0.75, "y": 0.28 }, "visible": true, "weight": 1, "critical": true },
    "leftWrist": { "position": { "x": 0.08, "y": 0.3 }, "visible": true, "weight": 1, "critical": true },
    "rightWrist": { "position": { "x": 0.92, "y": 0.3 }, "visible": true, "weight": 1, "critical": true },
    "leftPinky": { "position": { "x": 0.062, "y": 0.303 }, "visible": true, "weight": 0.35, "critical": false },
    "rightPinky": { "position": { "x": 0.938, "y": 0.303 }, "visible": true, "weight": 0.35, "critical": false },
    "leftIndex": { "position": { "x": 0.058, "y": 0.293 }, "visible": true, "weight": 0.35, "critical": false },
    "rightIndex": { "position": { "x": 0.942, "y": 0.293 }, "visible": true, "weight": 0.35, "critical": false },
    "leftThumb": { "position": { "x": 0.071, "y": 0.286 }, "visible": true, "weight": 0.3, "critical": false },
    "rightThumb": { "position": { "x": 0.929, "y": 0.286 }, "visible": true, "weight": 0.3, "critical": false },
    "leftHip": { "position": { "x": 0.455, "y": 0.53 }, "visible": true, "weight": 0.65, "critical": false },
    "rightHip": { "position": { "x": 0.545, "y": 0.53 }, "visible": true, "weight": 0.65, "critical": false },
    "leftKnee": { "position": { "x": 0.45, "y": 0.74 }, "visible": true, "weight": 0.45, "critical": false },
    "rightKnee": { "position": { "x": 0.55, "y": 0.74 }, "visible": true, "weight": 0.45, "critical": false },
    "leftAnkle": { "position": { "x": 0.445, "y": 0.92 }, "visible": true, "weight": 0.45, "critical": true },
    "rightAnkle": { "position": { "x": 0.555, "y": 0.92 }, "visible": true, "weight": 0.45, "critical": true },
    "leftHeel": { "position": { "x": 0.435, "y": 0.952 }, "visible": true, "weight": 0.25, "critical": false },
    "rightHeel": { "position": { "x": 0.565, "y": 0.952 }, "visible": true, "weight": 0.25, "critical": false },
    "leftFootIndex": { "position": { "x": 0.42, "y": 0.975 }, "visible": true, "weight": 0.3, "critical": true },
    "rightFootIndex": { "position": { "x": 0.58, "y": 0.975 }, "visible": true, "weight": 0.3, "critical": true }
  },
  "relations": [
    {
      "type": "distance",
      "from": "leftWrist",
      "to": "rightWrist",
      "target": 0.84,
      "tolerance": 0.18,
      "critical": true,
      "simpleHint": "双臂再打开一点"
    },
    {
      "type": "distance",
      "from": "leftWrist",
      "to": "leftShoulder",
      "target": 0.33,
      "tolerance": 0.14,
      "critical": true,
      "simpleHint": "左手再往外一点"
    },
    {
      "type": "distance",
      "from": "rightWrist",
      "to": "rightShoulder",
      "target": 0.33,
      "tolerance": 0.14,
      "critical": true,
      "simpleHint": "右手再往外一点"
    }
  ],
  "guideContour": [
    { "x": 0.5, "y": 0.065 },
    { "x": 0.452, "y": 0.105 },
    { "x": 0.45, "y": 0.18 },
    { "x": 0.405, "y": 0.225 },
    { "x": 0.245, "y": 0.245 },
    { "x": 0.07, "y": 0.27 },
    { "x": 0.045, "y": 0.31 },
    { "x": 0.08, "y": 0.34 },
    { "x": 0.255, "y": 0.315 },
    { "x": 0.405, "y": 0.295 },
    { "x": 0.43, "y": 0.55 },
    { "x": 0.425, "y": 0.91 },
    { "x": 0.405, "y": 0.985 },
    { "x": 0.5, "y": 0.97 },
    { "x": 0.595, "y": 0.985 },
    { "x": 0.575, "y": 0.91 },
    { "x": 0.57, "y": 0.55 },
    { "x": 0.595, "y": 0.295 },
    { "x": 0.745, "y": 0.315 },
    { "x": 0.92, "y": 0.34 },
    { "x": 0.955, "y": 0.31 },
    { "x": 0.93, "y": 0.27 },
    { "x": 0.755, "y": 0.245 },
    { "x": 0.595, "y": 0.225 },
    { "x": 0.55, "y": 0.18 },
    { "x": 0.548, "y": 0.105 },
    { "x": 0.5, "y": 0.065 }
  ],
  "tolerancePresets": {
    "easy": { "matchThreshold": 72, "stableMs": 600, "landmarkDistance": 0.3, "angleDifferenceDeg": 36 },
    "standard": { "matchThreshold": 82, "stableMs": 600, "landmarkDistance": 0.22, "angleDifferenceDeg": 26 },
    "precise": { "matchThreshold": 90, "stableMs": 600, "landmarkDistance": 0.15, "angleDifferenceDeg": 18 }
  },
  "review": {
    "status": "needs-review",
    "notes": "Research-source admission is complete at 5 posts and 5 stable creators. Coordinates and contour are a Posey-owned symmetric abstract draft, not traced from research screenshots. Requires authorized-person calibration across 3-5 back-facing arm-height and stance variants, false-pass testing against front-facing arms-open poses, and real-device acceptance before approval."
  }
}
